Can the US-China Rivalry Benefit Both Superpowers?,https://www.bloomberg.com/news/newsletters/2023-07-08/can-the-us-china-rivalry-benefit-both-superpowers,08-Jul-23
Gallium Prices Jump as Buyers Lock in Supply Before China Curbs,https://www.bloomberg.com/news/articles/2023-07-07/gallium-prices-jump-as-buyers-lock-in-supply-before-china-curbs,07-Jul-23
Gold Miner Gains 3.2% After Indonesia's Largest IPO This Year,https://www.bloomberg.com/news/articles/2023-07-07/gold-miner-gains-3-2-after-indonesia-s-largest-ipo-this-year,06-Jul-23
Deadly Attack at Colombia Coal Producer Sparks Industry Plea to Protect Miners,https://www.bloomberg.com/news/articles/2023-07-06/deadly-attack-at-colombia-coal-producer-sparks-industry-plea-to-protect-miners,06-Jul-23
Supply Chain Latest: Australia's Trade Bonanza to See Old Coal Trump New Energy,https://www.bloomberg.com/news/newsletters/2023-07-06/supply-chain-latest-australia-s-trade-bonanza-to-see-old-coal-trump-new-energy,06-Jul-23
The US and China Aim to Fight Nicely Over Trade Technology and Taiwan,https://www.bloomberg.com/news/newsletters/2023-07-06/the-us-and-china-aim-to-fight-nicely-over-trade-technology-and-taiwan,06-Jul-23
UK Mining: Cornwall Can Counter China in Hunt for Raw Minerals,https://www.bloomberg.com/news/features/2023-07-06/uk-mining-cornwall-can-counter-china-in-hunt-for-raw-minerals,06-Jul-23
European Stocks Decline on China Data; Traders Eye Fed Minutes,https://www.bloomberg.com/news/articles/2023-07-05/european-stocks-decline-on-china-data-traders-eye-fed-minutes,05-Jul-23
LME Nickel Chaos: A Car Crash Waiting to Happen,https://www.bloomberg.com/opinion/articles/2023-07-05/lme-nickel-chaos-a-car-crash-waiting-to-happen,05-Jul-23
Miner Set to Trade After Indonesia's Biggest 2023 IPO,https://www.bloomberg.com/news/articles/2023-07-05/gold-miner-set-to-trade-after-indonesia-s-biggest-ipo-this-year,04-Jul-23
