The world in brief | The Economist,https://www.economist.com/the-world-in-brief,2023-07-09
Copper is unexpectedly getting cheaper,https://www.economist.com/finance-and-economics/2023/07/06/copper-is-unexpectedly-getting-cheaper,Jul 6th 2023
How to win the battle against inflation,https://www.economist.com/finance-and-economics/2023/07/06/how-to-win-the-battle-against-inflation,Jul 6th 2023
The world needs more battery metals. Time to mine the seabed,https://www.economist.com/leaders/2023/07/06/the-world-needs-more-battery-metals-time-to-mine-the-seabed,Jul 6th 2023
Does it pay to be a communist in China?,https://www.economist.com/finance-and-economics/2023/07/06/does-it-pay-to-be-a-communist-in-china,Jul 6th 2023
Erdoganomics is spreading across the world,https://www.economist.com/finance-and-economics/2023/07/06/erdoganomics-is-spreading-across-the-world,Jul 6th 2023
How far will Wall Street job losses go?,https://www.economist.com/finance-and-economics/2023/07/06/how-far-will-wall-street-job-losses-go,Jul 6th 2023
Economists draw swords over how to fix inflation,https://www.economist.com/finance-and-economics/2023/07/05/economists-draw-swords-over-how-to-fix-inflation,Jul 5th 2023
